{
  "schema": "himind.asset-pack.v1",
  "id": "isometric-infographic",
  "version": "1.0.0",
  "name": "等距信息图",
  "description": "等距模块、立体卡片、流程箭头与信息图层。",
  "license": "MIT",
  "attribution": "HiMind original isometric-infographic style pack.",
  "resources": [
    {
      "id": "template",
      "type": "template",
      "path": "template",
      "role": "render-template",
      "runtime": "browser-code",
      "entry": "render.mjs",
      "format": "directory"
    },
    {
      "id": "preview",
      "type": "image",
      "path": "preview/sheet.jpg",
      "role": "preview",
      "mime": "image/jpeg"
    },
    {
      "id": "storyboard",
      "type": "docs",
      "path": "template/STORYBOARD.md",
      "role": "storyboard",
      "mime": "text/markdown"
    },
    {
      "id": "preview_loop",
      "type": "image",
      "path": "preview/loop.webp",
      "role": "preview_loop",
      "mime": "image/webp"
    }
  ],
  "entrypoints": [
    {
      "id": "render",
      "resource": "template",
      "runtime": "browser-code",
      "entry": "render.mjs",
      "inputs": [
        "brief.json",
        "data.json"
      ],
      "outputs": [
        "video.mp4",
        "video-web.mp4"
      ]
    }
  ],
  "provenance": {
    "source": "https://github.com/MrBaoquan/himind-media-studio",
    "commit": "local",
    "license": "MIT",
    "adapted_files": [
      "procedural Canvas 2D"
    ],
    "changes": [
      "new style pack"
    ]
  },
  "permissions": {
    "filesystem": "workspace",
    "process": [
      "node",
      "chrome",
      "ffmpeg"
    ],
    "network": {
      "mode": "none",
      "allow": []
    }
  },
  "quality": {
    "smoke": "preview/sheet.jpg",
    "determinism": true
  },
  "consumers": [
    "com.himind.media-workbench"
  ],
  "tags": [
    "video",
    "style",
    "isometric",
    "infographic",
    "diagram",
    "flow"
  ]
}
