{
  "schema": "himind.asset-pack.v1",
  "id": "transit-network",
  "version": "1.0.0",
  "name": "线网地图动画",
  "description": "白底官方线网图风格的地铁 / 轨道交通网络生长动画：线路生长、站点出现、换乘脉冲、站名避让与年份轴。",
  "license": "MIT",
  "attribution": "HiMind original transit-network composition. Hefei line names are used in a schematic demo subset; not an official map and not for navigation.",
  "resources": [
    {"id":"template","type":"template","path":"template","role":"render-template","runtime":"browser-code","entry":"render.mjs","format":"directory"},
    {"id":"preview","type":"image","path":"preview/sheet.jpg","role":"preview","mime":"image/jpeg"},
    {"id":"storyboard","type":"docs","path":"template/STORYBOARD.md","role":"storyboard","mime":"text/markdown"},
    {"id":"preview_loop","type":"image","path":"preview/loop.webp","role":"preview_loop","mime":"image/webp"}
  ],
  "entrypoints": [
    {"id":"render","resource":"template","runtime":"browser-code","entry":"render.mjs","inputs":["brief.json","data.json"],"outputs":["video.mp4","video-web.mp4"]}
  ],
  "permissions": {"filesystem":"workspace","process":["node","chrome","ffmpeg"],"network":{"mode":"none","allow":[]}},
  "quality": {"smoke":"preview/sheet.jpg","determinism":true},
  "consumers": ["com.himind.media-workbench"],
  "tags": ["video","style","map","transit","metro","schematic","2d","white"]
}
