{
  "schema": "himind.asset-pack.v1",
  "id": "data-kinetic",
  "version": "1.0.0",
  "name": "数据动态字卡",
  "description": "数据驱动的动态字体与卡片动画，读取 input/data.json。",
  "license": "MIT",
  "attribution": "HiMind data-kinetic style pack.",
  "resources": [
    {
      "id": "template",
      "type": "template",
      "path": "template",
      "role": "render-template",
      "runtime": "browser-code",
      "entry": "render.mjs",
      "format": "directory"
    },
    {
      "id": "preview",
      "type": "image",
      "path": "preview/sheet.jpg",
      "role": "preview",
      "mime": "image/jpeg"
    },
    {
      "id": "storyboard",
      "type": "docs",
      "path": "template/STORYBOARD.md",
      "role": "storyboard",
      "mime": "text/markdown"
    },
    {
      "id": "preview_loop",
      "type": "image",
      "path": "preview/loop.webp",
      "role": "preview_loop",
      "mime": "image/webp"
    }
  ],
  "entrypoints": [
    {
      "id": "render",
      "resource": "template",
      "runtime": "browser-code",
      "entry": "render.mjs",
      "inputs": [
        "brief.json",
        "data.json"
      ],
      "outputs": [
        "video.mp4",
        "video-web.mp4"
      ]
    }
  ],
  "provenance": {
    "source": "https://github.com/tuzhechen2005/opus-video-skills",
    "commit": "local-adaptation",
    "license": "MIT",
    "adapted_files": [
      "kinetic-mini Canvas renderer"
    ],
    "changes": [
      "data.json input",
      "asset-pack.json",
      "style library integration"
    ]
  },
  "permissions": {
    "filesystem": "workspace",
    "process": [
      "node",
      "chrome",
      "ffmpeg"
    ],
    "network": {
      "mode": "none",
      "allow": []
    }
  },
  "quality": {
    "smoke": "preview/sheet.jpg",
    "determinism": true
  },
  "consumers": [
    "com.himind.media-workbench"
  ],
  "tags": [
    "video",
    "style",
    "data",
    "kinetic",
    "ranking"
  ]
}
